Sheet: Table1
A1: sum(MULT) | B1: grade(course0,student0) | C1: intelligence(student0) | K1: capability | L1: intel | M1: Count
A2: 7 | B2: 1 | C2: 2 | K2: 1 | L2: 2 | M2: 3
A3: 25 | B3: 1 | C3: 3 | K3: 1 | L3: 3 | M3: 2
A4: 1 | B4: 2 | C4: 1 | K4: 2 | L4: 2 | M4: 3
A5: 17 | B5: 2 | C5: 2 | K5: 2 | L5: 3 | M5: 1
A6: 11 | B6: 2 | C6: 3 | K6: 3 | L6: 1 | M6: 2
A7: 12 | B7: 3 | C7: 1 | K7: 3 | L7: 2 | M7: 4
A8: 6 | B8: 3 | C8: 2 | K8: 3 | L8: 3 | M8: 1
A9: 13 | B9: 4 | C9: 1 | K9: 4 | L9: 1 | M9: 1
A10: 114 | B10: N/A | C10: 1 | K10: 4 | L10: 3 | M10: 4
A11: 100 | B11: N/A | C11: 2 | K11: 5 | L11: 1 | M11: 1
A12: 74 | B12: N/A | C12: 3 | K12: 5 | L12: 2 | M12: 3
K13: N/A | L13: 1 | M13: 80
K14: N/A | L14: 2 | M14: 65
K15: N/A | L15: 3 | M15: 58
I16: total: 38*6 | J16: =SUM(R[-14]C[3]:R[-1]C[3]) -> 228
J19: Count | K19: capability
J20: 5 | K20: 1
J21: 4 | K21: 2
J22: 7 | K22: 3
J23: 5 | K23: 4
J24: 4 | K24: 5
J25: 203 | K25: N/A
J39: count | K39: grade
J40: 32 | K40: 1
J41: 29 | K41: 2
J42: 18 | K42: 3
J43: 13 | K43: 4
J44: 288 | K44: N/A
I45: total:10*38 | J45: =SUM(R[-5]C:R[-1]C) -> 380

Sheet: CIKM_slides
A1: a_counts
A2: Count | B2: pop | C2: teach | D2: intel | E2: rank | F2: cap | G2: salary | H2: RA
A3: 2 | B3: 2 | C3: 2 | D3: 3 | E3: 1 | F3: 4 | G3: high | H3: T
A4: 2 | B4: 2 | C4: 3 | D4: 1 | E4: 4 | F4: 3 | G4: med | H4: T
A5: 1 | B5: 1 | C5: 2 | D5: 2 | E5: 2 | F5: 1 | G5: med | H5: T
A6: 1 | B6: 1 | C6: 2 | D6: 2 | E6: 2 | F6: 2 | G6: med | H6: T | M6: ct(Prof.) | R6: a_star
A7: 1 | B7: 1 | C7: 2 | D7: 2 | E7: 2 | F7: 3 | G7: low | H7: T | M7: Count | N7: pop | O7: teach | R7: MULT | S7: pop | T7: teach | U7: intel | V7: rank
A8: 1 | B8: 1 | C8: 2 | D8: 3 | E8: 1 | F8: 3 | G8: high | H8: T | M8: 2 | N8: 1 | O8: 2 | R8: 12 | S8: 1 | T8: 2 | U8: 1 | V8: 4
A9: 1 | B9: 2 | C9: 2 | D9: 2 | E9: 3 | F9: 1 | G9: low | H9: T | M9: 1 | N9: 2 | O9: 2 | R9: 16 | S9: 1 | T9: 2 | U9: 1 | V9: 5
A10: 1 | B10: 2 | C10: 2 | D10: 2 | E10: 3 | F10: 5 | G10: high | H10: T | M10: 3 | N10: 2 | O10: 3 | R10: 10 | S10: 1 | T10: 2 | U10: 2 | V10: 2
A11: 1 | B11: 2 | C11: 2 | D11: 2 | E11: 4 | F11: 3 | G11: med | H11: T | R11: 14 | S11: 1 | T11: 2 | U11: 2 | V11: 3
A12: 1 | B12: 2 | C12: 2 | D12: 3 | E12: 2 | F12: 1 | G12: med | H12: T | M12: ct(Student) | R12: 2 | S12: 1 | T12: 2 | U12: 2 | V12: 4
A13: 1 | B13: 2 | C13: 3 | D13: 1 | E13: 4 | F13: 4 | G13: high | H13: T | M13: Count | N13: intel | O13: rank | R13: 16 | S13: 1 | T13: 2 | U13: 3 | V13: 1
A14: 1 | B14: 2 | C14: 3 | D14: 1 | E14: 4 | F14: 5 | G14: high | H14: T | M14: 6 | N14: 1 | O14: 4 | R14: 6 | S14: 1 | T14: 2 | U14: 3 | V14: 2
A15: 1 | B15: 2 | C15: 3 | D15: 2 | E15: 2 | F15: 2 | G15: low | H15: T | M15: 8 | N15: 1 | O15: 5 | R15: 6 | S15: 2 | T15: 2 | U15: 1 | V15: 4
A16: 1 | B16: 2 | C16: 3 | D16: 2 | E16: 2 | F16: 5 | G16: high | H16: T | M16: 5 | N16: 2 | O16: 2 | R16: 8 | S16: 2 | T16: 2 | U16: 1 | V16: 5
A17: 1 | B17: 2 | C17: 3 | D17: 2 | E17: 3 | F17: 1 | G17: med | H17: T | M17: 7 | N17: 2 | O17: 3 | R17: 5 | S17: 2 | T17: 2 | U17: 2 | V17: 2
A18: 1 | B18: 2 | C18: 3 | D18: 2 | E18: 3 | F18: 2 | G18: med | H18: T | M18: 1 | N18: 2 | O18: 4 | R18: 7 | S18: 2 | T18: 2 | U18: 2 | V18: 3
A19: 1 | B19: 2 | C19: 3 | D19: 2 | E19: 3 | F19: 3 | G19: high | H19: T | M19: 8 | N19: 3 | O19: 1 | R19: 1 | S19: 2 | T19: 2 | U19: 2 | V19: 4
A20: 1 | B20: 2 | C20: 3 | D20: 2 | E20: 3 | F20: 3 | G20: med | H20: T | M20: 3 | N20: 3 | O20: 2 | R20: 8 | S20: 2 | T20: 2 | U20: 3 | V20: 1
A21: 1 | B21: 2 | C21: 3 | D21: 2 | E21: 3 | F21: 5 | G21: high | H21: T | R21: 3 | S21: 2 | T21: 2 | U21: 3 | V21: 2
A22: 1 | B22: 2 | C22: 3 | D22: 3 | E22: 1 | F22: 1 | G22: low | H22: T | R22: 18 | S22: 2 | T22: 3 | U22: 1 | V22: 4
A23: 1 | B23: 2 | C23: 3 | D23: 3 | E23: 1 | F23: 2 | G23: low | H23: T | R23: 24 | S23: 2 | T23: 3 | U23: 1 | V23: 5
A24: 1 | B24: 2 | C24: 3 | D24: 3 | E24: 1 | F24: 4 | G24: high | H24: T | R24: 15 | S24: 2 | T24: 3 | U24: 2 | V24: 2
A25: 1 | B25: 2 | C25: 3 | D25: 3 | E25: 2 | F25: 4 | G25: high | H25: T | R25: 21 | S25: 2 | T25: 3 | U25: 2 | V25: 3
R26: 3 | S26: 2 | T26: 3 | U26: 2 | V26: 4
R27: 24 | S27: 2 | T27: 3 | U27: 3 | V27: 1
R28: 9 | S28: 2 | T28: 3 | U28: 3 | V28: 2
C30: Dataset | D30: #Relationship Tables/ Total | E30: # Rows | F30: # Columns
C31: UW-CSE | D31: 2/4 | E31: 712 | F31: 14
C32: Mondial | D32: 2/4 | E32: 870 | F32: 18
C33: Hepatitis | D33: 3/7 | E33: 12927 | F33: 19
C34: Mutagenesis | D34: 2/4 | E34: 14540 | F34: 11
C35: Financial | D35: 3/7 | E35: 225932 | F35: 15
C36: Movielens | D36: 1/3 | E36: 1010051 | F36: 7
C37: IMDB | D37: 3/7 | E37: 1354134 | F37: 17
C40: Dataset | D40: Our Dynamic Program | E40: Cross Product Time | F40: #Sufficient Statistics Computed | J40: Dataset | K40: #Sufficient Statistics Computed | L40: Cross Product Time | M40: Our Dynamic Program
C41: Movielens | D41: 2.7 | E41: 703.99 | F41: 252 | J41: Movielens | K41: 252 | L41: 703.99 | M41: 2.7
C42: Mutagenesis | D42: 1.67 | E42: 1096 | F42: 1631 | J42: Mutagenesis | K42: 1631 | L42: 1096 | M42: 1.67
C43: Financial | D43: 1421.87 | E43: N.T. | F43: 3013011 | J43: UW-CSE | K43: 2828 | L43: 350.3 | M43: 3.84
C44: Hepatitis | D44: 3536.76 | E44: N.T. | F44: 12374892 | J44: Mondial | K44: 1746870 | L44: 132.13 | M44: 1112.8399999999999
C45: IMDB | D45: 7467.85 | E45: N.T. | F45: 15538430 | J45: Financial | K45: 3013011 | L45: N.T. | M45: 1421.87
C46: Mondial | D46: 1112.8399999999999 | E46: 132.13 | F46: 1746870 | J46: Hepatitis | K46: 12374892 | L46: N.T. | M46: 3536.76
C47: UW-CSE | D47: 3.84 | E47: 350.3 | F47: 2828 | J47: IMDB | K47: 15538430 | L47: N.T. | M47: 7467.85
C53: Dataset | D53: Target Variable | E53: Selected Attributes | G53: Distinctness
E54: Link Analysis Off | F54: Link Analysis On/Relationship Indicators
C55: MovieLens | D55: Horror | E55: 2 | F55: 2/0 | G55: 0
C56: Mutagenesis | D56: inda | E56: 3 | F56: 3/0 | G56: 0
C57: Financial | D57: balance | E57: 3 | F57: 2/1 | G57: 1
C58: Hepatitis | D58: sex | E58: =1 -> 1 | F58: 2/1 | G58: =1/2 -> 0.5
C59: IMDB | D59: avg_revenue | E59: =5 -> 5 | F59: 2/1 | G59: 1
C60: Mondial | D60: percentage | E60: empty CT table | F60: 4/0 | G60: 1
C61: UW-CSE | D61: courseLevel | E61: 1 | F61: 4/2 | G61: 1